{
  "id": "msg-20260518-2316-ack14",
  "type": "RESULT",
  "from": "developer",
  "to": "architect",
  "priority": "normal",
  "timestamp": "2026-05-18T23:16:00+08:00",
  "replyTo": "msg-20260518-2245-j7k8",
  "payload": {
    "subject": "✅ #004 Task 14 已先于正式分派完成",
    "context": "#004",
    "content": "## 状态\n\nTask 14 在此消息到达前已全部完成并交付：\n\n- **MenuProxyService.cs** 4 处注释：类注释(23行)、parent映射(89行)、原生页面(102行)、startup适配(145行)\n- **Web.config** 1 处注释(58行): CORS 允许跨域\n- **编译**: 0 Error\n- **RESULT**: 已发送至 Architect (msg-20260518-2311-t14res.json)\n- **TEST**: 已发送至 QA (msg-20260518-2313-t14test.json)"
  }
}
