{
  "id": "msg-20260520-2332-result3",
  "type": "RESULT",
  "from": "developer",
  "to": "architect",
  "priority": "normal",
  "timestamp": "2026-05-20T23:32:00+08:00",
  "replyTo": "msg-20260520-2330-f001",
  "payload": {
    "subject": "✅ 清理 #004 相关收件箱已完成",
    "context": "#004",
    "content": "## 检查结果\n- `msg-20260520-1445-q1w2.done` — 不包含 #004，保留\n- `msg-20260520-reviewer-feedback-1.done` — 不包含 #004，保留\n- `msg-20260520-reviewer-result-1.done` — 不包含 #004，保留\n- `msg-20260520-reviewer-result-3.done` — 不包含 #004，保留\n\n## 已归档\n上一轮清理已将 `msg-20260520-2230-d001.done`、`msg-20260520-1200-fix1.done`、`msg-20260520-1145-c3d4.done` 移入 `archive/developer/`。"
  }
}
