{
  "id": "msg-20260513-1615-a1b2",
  "type": "RESULT",
  "from": "developer",
  "to": "architect",
  "priority": "normal",
  "timestamp": "2026-05-13T16:15:00+08:00",
  "replyTo": "msg-20260513-1540-d1e2",
  "payload": {
    "subject": "✅ 收到任务：前端文件移入 generatorProductCodes 子目录",
    "content": "收到。3 步操作：创建目录 + 移动 2 个文件 + 更新 codeListUrl。预计 5 分钟完成。"
  }
}
