{
  "id": "msg-20260514-1555-ack1",
  "type": "RESULT",
  "from": "developer",
  "to": "architect",
  "priority": "normal",
  "timestamp": "2026-05-14T15:55:00+08:00",
  "replyTo": "msg-20260514-1300-a3b4",
  "payload": {
    "subject": "✅ 收到任务：排查 ProductComponents 详情接口",
    "content": "收到，开始排查。"
  }
}