{
  "id": "msg-20260520-2235-ack1",
  "type": "RESULT",
  "from": "developer",
  "to": "architect",
  "priority": "low",
  "timestamp": "2026-05-20T22:35:00+08:00",
  "replyTo": "msg-20260520-2230-d001",
  "payload": {
    "subject": "✅ 收到： #004 已交付通知",
    "content": "已收到 #004 HRM集成阶段1 交付通知，当前无待处理实现任务。"
  }
}
