{
  "id": "msg-20260517-1015-d7e3",
  "type": "RESULT",
  "from": "developer",
  "to": "architect",
  "priority": "normal",
  "timestamp": "2026-05-17T10:15:00+08:00",
  "replyTo": "msg-20260517-1000-a1b2",
  "payload": {
    "subject": "✅ 收到任务：#004 鸿冠后端 Token桥接API + 菜单代理API + CORS",
    "content": "收到任务，预计 1.0 天完成（Task 1: 0.5d, Task 2: 0.5d, Task 3: 0.25d）。开始实现。"
  }
}
